order_id,customer_id,date,nearest_warehouse,shopping_cart,order_price,delivery_charges,customer_lat,customer_long,delivery_discount,season,is_expedited_delivery,distance_to_nearest_warehouse,latest_customer_review,is_happy_customer,pred1,delivery_charges2,residual
ORD171686,ID6167229084,2022-02-11,Thompson,"[('pearTV', 2), ('Olivia x460', 1), ('Lucent 330S', 2), ('Alcon 10', 1)]",25255,71.973,-37.8200469,144.95476619999997,25,Summer,True,1.06392,good buy it's cheaper than any store or online shop. it's good quality for standard cell phone usage.,True,95.68431027316474,95.72409,0.03977972683526332
ORD398456,ID0583473314,2022-12-10,Bakers,"[('iStream', 2), ('iAssist Line', 1)]",2525,67.23899999999999,-37.80564520000001,144.9952511,25,Summer,True,0.48433000000000004,five stars great buy!!,True,89.92804291654528,89.42787,0.5001729165452815
ORD311979,ID5424203828,2022-09-22,Nickolson,"[('Universe Note', 2), ('pearTV', 2)]",19520,58.183,-37.822573,144.9793059,25,Spring,False,0.96534,best android phone and phone ever best phone soo far. display and ui usability is as smooth as butter. camera is top-notch. it feels soo good typing from my s7 edge 32gb 🤗,True,77.53895496761007,77.38339,0.15556496761006144
ORD107061,ID0282825775,2022-10-20,Thompson,"[('pearTV', 1), ('Alcon 10', 2)]",24210,77.375,-37.80297570000001,144.9515461,0,Spring,False,1.14907,long life battery i wanted a small fone to slip in my pocket and i like the fact thats its a flip cover protects the main screen. its cute & the plan is cheap. in fact i have 3 gustos. it has the same basic features as those touch screen ones do. and so so easy to use. its a must have.,True,79.03736145719077,77.375,1.6623614571907694
ORD118660,ID1462398968,2022-12-12,Bakers,"[('Olivia x460', 2), ('Universe Note', 1)]",5900,35.285,-37.8201747,145.01397980000004,50,Summer,False,2.00049,can't use no longer able to use phone with metro can't use phone on metro with that phone i'd. waste of money,False,70.05320017003704,70.57,0.5167998299629488
ORD130596,ID2005895266,2022-02-24,Nickolson,"[('pearTV', 2), ('Lucent 330S', 2)]",15080,41.138000000000005,-37.8028167,144.96650680000005,50,Summer,False,1.77668,great it's nice,True,82.74708866694189,82.27600000000001,0.47108866694188123
ORD127666,ID4380043465,2022-07-19,Nickolson,"[('Candle Inferno', 1), ('Universe Note', 2), ('iStream', 2), ('iAssist Line', 1)]",9855,66.982,-37.8215556,144.9839245,0,Winter,False,1.30618,so far so good phone works well and was easy to set up with att.,True,67.71169196907454,66.982,0.7296919690745369
ORD293785,ID1449308646,2022-11-09,Bakers,"[('Olivia x460', 2), ('Lucent 330S', 1), ('Thunder line', 2)]",8040,39.225,-37.8163438,144.987727,50,Spring,False,0.9669,purchased two inferno8 tablets for my children. my son loves it for reading books from library and my daughter loves listening to audio books.they both were not sure they would like the tablet but they really love them.,True,77.55167751767672,78.45,0.8983224823232803
ORD284580,ID0310728381,2022-07-11,Thompson,"[('Toshika 750', 2), ('Olivia x460', 2), ('iStream', 1)]",11240,37.666,-37.8125886,144.93755249999995,25,Winter,False,0.83695,sim card issues. the phone seems fantastic when it chooses to recognize my sim card but so far the cell i received from them i have had to remove and reinsert my son card at least two times a day sometimes more often and is very frustrating.,False,49.79407413061398,50.09578,0.3017058693860193
ORD118209,ID0560997639,2022-06-24,Thompson,"[('iStream', 1), ('Toshika 750', 2), ('iAssist Line', 1), ('Alcon 10', 1)]",19965,32.958,-37.810505600000006,144.9376672,50,Winter,False,0.86131,"great! pretty happy with my purchase. i broke my s7 edge and wanted another one. verizon has new ones for around 750, but 350 refurbished is a great deal. very very little wear around the home button and that's it. connected to verizon through my already existing sim card. works great so far.",True,65.09862115668822,65.916,0.8173788433117721
ORD072591,ID2190566770,2022-08-26,Nickolson,"[('pearTV', 2), ('Thunder line', 2)]",16980,48.681999999999995,-37.8171409,144.9644869,25,Winter,False,0.47381999999999996,"love olivia phones this is our 3rd s8+! we love this phone, reliable, long battery life, and easy to use",True,62.82258813784773,64.74705999999999,1.9244718621522594
ORD343966,ID6212685642,2022-02-17,Bakers,"[('iAssist Line', 1), ('Candle Inferno', 1)]",2655,95.62299999999999,-37.8164624,144.9860256,0,Summer,True,1.08334,quality phone from a personable company-wireless extra i am pleased with the phone and wireless extra is willing to support you with any problems that may occur.,True,95.8771823242104,95.62299999999999,0.25418232421040443
ORD028415,ID4957761329,2022-09-22,Thompson,"[('Thunder line', 2), ('iStream', 2), ('Alcon 10', 2)]",22560,48.385,-37.8255049,144.92891569999995,50,Spring,True,2.14207,poor battery life i bought it as used phone. after 1 month the battery started dying quickly.,False,97.38177942802474,96.77,0.6117794280247466
ORD378146,ID4754200391,2022-05-04,Thompson,"[('Candle Inferno', 1), ('Thunder line', 2), ('Toshika 750', 2)]",13430,40.696999999999996,-37.8160703,144.9287191,25,Autumn,False,1.6574099999999998,box only! the cellphone was not found!,False,53.687730565385415,54.12701,0.4392794346145834
ORD224512,ID4245791607,2022-01-11,Thompson,"[('Alcon 10', 2), ('iAssist Line', 2), ('Candle Inferno', 2)]",23210,85.289,-37.8012198,144.9630195,0,Summer,False,1.89565,"great phone it's a great, durable phone",True,83.92865344103566,85.289,1.3603465589643378
ORD129079,ID0301548220,2022-07-11,Bakers,"[('Thunder line', 1), ('pearTV', 2), ('iStream', 1)]",14950,58.321000000000005,-37.806555700000004,144.9852247,25,Winter,True,0.9598399999999999,five stars the phone came in great conditions as said functions perfect not one complaint for a used phone,True,77.61421282547371,77.56693000000001,0.047282825473700996
ORD169842,ID0589501834,2022-04-17,Nickolson,"[('Toshika 750', 1), ('Candle Inferno', 1), ('Lucent 330S', 2), ('iAssist Line', 1)]",9435,49.195,-37.820255100000004,144.9573457,25,Autumn,True,1.0890600000000001,one star not working well after 5 months,False,65.38242098856833,65.42935,0.04692901143167205
ORD092793,ID0053133031,2022-04-07,Thompson,"[('pearTV', 2), ('Candle Inferno', 1), ('iStream', 2), ('iAssist Line', 2)]",17800,53.133,-37.79934179999999,144.9543752,0,Autumn,False,1.61716,one star very bad experience,False,53.52498938342091,53.133,0.3919893834209063
ORD069978,ID0710018065,2022-12-18,Thompson,"[('Thunder line', 2), ('pearTV', 2), ('Universe Note', 2), ('Toshika 750', 1)]",28200,72.725,-37.8151591,144.93646280000004,0,Summer,False,0.9729,i purchased it for my friend and he love it. it has money value for the price. i purchased it for my friend and he love it.,True,74.76425153051167,72.725,2.0392515305116774
ORD266783,ID0777834973,2022-10-20,Thompson,"[('Alcon 10', 1), ('pearTV', 1), ('Toshika 750', 2), ('iAssist Line', 1)]",26125,65.923,-37.8026405,144.9577484,0,Spring,False,1.45926,it sucks can't play fort nite too weak and it can not text or call pear users,False,66.60027472814657,65.923,0.6772747281465712
ORD119800,ID4418536089,2022-07-15,Thompson,"[('Alcon 10', 2), ('Lucent 330S', 1)]",19130,70.411,-37.80227670000001,144.9631881,0,Winter,False,1.8300599999999998,"very pleased! always sort of concerned about buying used electronic products, but this has turned out to be a real winner - just as good as a new one!",True,70.78885054841894,70.411,0.37785054841893384
ORD037699,ID0060096663,2022-08-01,Nickolson,"[('Thunder line', 2), ('Lucent 330S', 2), ('Toshika 750', 2), ('pearTV', 1)]",21770,38.81,-37.8167591,144.9822729,25,Winter,False,1.13724,unreliable so far keeps completely crashing and asking me to start set up all over! if i can’t get it working properly will have to return it! not happy!!,False,51.55791308188398,51.61730000000001,0.05938691811602581
ORD223416,ID0641022145,2022-07-09,Thompson,"[('Alcon 10', 1), ('Olivia x460', 1)]",10175,66.521,-37.80682720000001,144.9378833,0,Winter,False,1.03735,"overall a great product for a fair price the alcon that i received came as if it were brand new! really enjoying it and for the price that it is, i believe it’s worth the buy.",True,66.13264229952205,66.521,0.3883577004779539
ORD055352,ID6167489384,2022-09-25,Thompson,"[('iAssist Line', 2), ('Alcon 10', 2), ('iStream', 1), ('Universe Note', 1)]",25950,78.047,-37.8099171,144.95821619999995,0,Spring,False,1.0272299999999999,excellent. though i wish i had done more research ... excellent. though i wish i had done more research on the model and gone with a different one. this will do for now though. thanks.,True,78.04369767506203,78.047,0.003302324937962453
ORD365694,ID4353912827,2022-05-11,Bakers,"[('Lucent 330S', 2), ('Thunder line', 2)]",6820,43.07899999999999,-37.824817700000004,145.01295349999995,50,Autumn,True,2.26951,"a little heavy, but that's the price for a ... a little heavy, but that's the price for a long lasting battery these days. can't complain at all at this price point.",True,85.16573918514479,86.15799999999999,0.9922608148552001
ORD101794,ID5957906929,2022-10-30,Nickolson,"[('iAssist Line', 1), ('Lucent 330S', 2), ('iStream', 1), ('Candle Inferno', 2)]",5695,80.92,-37.8055335,144.97356159999995,25,Spring,True,1.49614,"gift the phone was for a gift but turned out ok, the person loves it. good phone for the price. is ok",True,107.08074502926281,107.62360000000001,0.5428549707371957
ORD240526,ID0702373335,2022-07-08,Thompson,"[('Alcon 10', 2), ('Candle Inferno', 2), ('pearTV', 1)]",25070,46.967,-37.8064749,144.9413413,25,Winter,True,0.85429,one star phone looks great but had some problem with battery,False,61.83277318075212,62.46611,0.6333368192478801
ORD138888,ID5402876143,2022-09-16,Nickolson,"[('iStream', 2), ('Candle Inferno', 2), ('pearTV', 2)]",13780,73.16,-37.819443400000004,144.9768094,0,Spring,False,0.64522,"just perfect as a new phone phone is as described, like new came with screen protector and also unlock for any service. i was with mobile before , since i got my phone, i switch to verizon and it is working perfectly.",True,74.92822245008671,73.16,1.7682224500867108
ORD325438,ID0122752809,2022-12-03,Thompson,"[('Alcon 10', 1), ('iAssist Line', 2)]",13400,75.149,-37.815026700000004,144.9412471,0,Summer,True,0.57511,not an unlocked phone. i bought this phone as a present for my uncle and i was greatly mortified when i realised it was locked after i gave it to him and transferred all his stuff onto it.,False,75.91295107511917,75.149,0.7639510751191665
ORD021601,ID0332797303,2022-05-14,Bakers,"[('pearTV', 1), ('Candle Inferno', 1), ('Toshika 750', 1)]",11060,63.04,-37.8101386,145.0007316,0,Autumn,False,0.48393,"thanks great experience i liked ,, thank you to the seller",True,63.95349968216776,63.04,0.9134996821677603
ORD350354,ID0319157922,2022-06-01,Nickolson,"[('Alcon 10', 2), ('Thunder line', 2), ('Toshika 750', 2), ('Candle Inferno', 2)]",31760,67.49,-37.8050698,144.96830780000005,0,Winter,True,1.50955,i don't have cable so it would not be valuable to me,False,65.68162965685582,67.49,1.8083703431441762
ORD050757,ID2207974405,2022-08-10,Thompson,"[('Alcon 10', 2), ('iStream', 2), ('Thunder line', 2)]",22560,59.532,-37.8028766,144.9482103,25,Winter,True,1.09514,our first tablet. purchased for my husband prior to a long train trip. downloaded movies had internet and was great for traveling.,True,78.40893596013298,79.17756,0.7686240398670208
ORD386748,ID0107156422,2022-09-09,Nickolson,"[('Alcon 10', 1), ('iAssist Line', 1), ('Thunder line', 1)]",13355,61.794,-37.827737799999994,144.9839878,25,Spring,False,1.62704,works great. bought as a gift for my boyfriend. easy & fun to use.,True,82.9354366208814,82.18602,0.749416620881405
ORD082497,ID6282174121,2022-08-30,Nickolson,"[('Alcon 10', 1), ('Thunder line', 1)]",11130,38.244,-37.8230512,144.9764732,50,Winter,True,0.78522,great great product,True,76.58853245759343,76.488,0.10053245759343099
ORD328509,ID0312718318,2022-06-14,Thompson,"[('pearTV', 2), ('iAssist Line', 2)]",17070,69.172,-37.803356,144.9618828,0,Winter,False,1.6652799999999999,perfect good,True,69.8209682266957,69.172,0.6489682266957004
ORD105774,ID4418536059,2022-05-18,Thompson,"[('iAssist Line', 2), ('iStream', 2), ('Toshika 750', 2)]",13390,42.215,-37.8019634,144.9633802,50,Autumn,True,1.8652799999999998,"works pretty good, only thing is the battery goes really ... works pretty good, only thing is the battery goes really fast.. a few scratches as expected but would like a better battery.",True,83.53133252711962,84.43,0.8986674728803905
ORD385664,ID0598400059,2022-01-05,Nickolson,"[('Lucent 330S', 2), ('Toshika 750', 1)]",6780,90.444,-37.8140249,144.9644216,0,Summer,True,0.67991,a great device,True,91.87046906193709,90.444,1.426469061937084
ORD157022,ID6167417980,2022-06-18,Nickolson,"[('Toshika 750', 2), ('Alcon 10', 2)]",26540,37.857,-37.8117601,144.9712728,25,Winter,False,0.77576,defective bad experience. it wasn't unlocked and i couldn't hear a thing thru the receiver. the rest was ok. it was in good condition except for that.,False,49.43465721553785,50.349810000000005,0.9151527844621583
ORD093828,ID2209383610,2022-06-05,Thompson,"[('Toshika 750', 1), ('pearTV', 1), ('Thunder line', 1)]",12810,52.407,-37.7996797,144.9575006,25,Winter,False,1.7128400000000001,pixel 4 nice device,True,70.10032544978804,69.70130999999999,0.3990154497880525
ORD219620,ID0060095425,2022-06-06,Bakers,"[('Toshika 750', 1), ('Alcon 10', 2), ('Olivia x460', 1)]",23445,71.27199999999999,-37.8246816,144.988878,0,Winter,False,1.7276,"amazing quality its amazing the price vs cost! the quality of the product is really good, im glad of the return of xp",True,70.1870225190236,71.27199999999999,1.0849774809763915
ORD201521,ID6167489423,2022-11-06,Thompson,"[('pearTV', 1), ('Thunder line', 2), ('iStream', 2), ('Universe Note', 1)]",14420,67.59899999999999,-37.810968,144.9586967,25,Spring,True,1.04006,cheap phones ??? after a few months the battery dies vey quickly. after 6 months the phone wont respond by the touch screen. has acted strange for quite a while. i've bought cheap phones that have lasted for several years this cheap touch phone isn't able to work for even a few months. i would not recommend buying this phone.,False,88.39435801844107,89.90666999999999,1.5123119815589234
ORD355547,ID0343337622,2022-11-27,Nickolson,"[('Universe Note', 2), ('Toshika 750', 1)]",11220,86.868,-37.80029920000001,144.9676887,0,Spring,False,2.0432099999999997,phone activated perfectly on verizon account. only downside is ... phone activated perfectly on verizon account. only downside is no warranty. if you buy this make sure you get the warranty. these phones are expensive to replace,True,86.32950307039314,86.868,0.5384969296068505
ORD348912,ID0702378611,2022-07-31,Thompson,"[('Toshika 750', 1), ('iAssist Line', 1), ('Universe Note', 1), ('pearTV', 1)]",16305,32.111999999999995,-37.8053574,144.94319950000005,50,Winter,False,0.8826200000000001,bought for my mom she loves the style - she's nearly 80 and refuses to use a smartphone. she's happy and that's good enough for me.,True,65.22379151884336,64.22399999999999,0.9997915188433666
ORD104608,ID0587652964,2022-10-30,Nickolson,"[('pearTV', 1), ('Thunder line', 1), ('Universe Note', 1), ('Olivia x460', 1)]",13165,52.178999999999995,-37.8251158,144.9588699,50,Spring,True,1.18702,five stars in an age of smart phones it's nice to be able to get a good quality flipper,True,104.55972280067095,104.35799999999999,0.20172280067096438
ORD046182,ID0575556331,2022-11-12,Nickolson,"[('Toshika 750', 2), ('Alcon 10', 1), ('Universe Note', 2)]",24490,69.722,-37.82614279999999,144.9850278,0,Spring,False,1.5993600000000001,one star stopped working 4 months after purchase. where is the info on warranty?,False,67.74285758990162,69.722,1.979142410098376
ORD169423,ID0387700309,2022-11-30,Nickolson,"[('Thunder line', 2), ('Lucent 330S', 1), ('iStream', 1), ('iAssist Line', 2)]",10190,73.263,-37.8210433,144.9653104,25,Spring,True,0.46187,it operates better and full of helpful and important apps this product is a quality product and operate better than my old phone.,True,98.64577588988104,97.43979000000002,1.2059858898810205
ORD237383,ID0372999711,2022-07-04,Bakers,"[('Olivia x460', 1), ('Universe Note', 2), ('iAssist Line', 2)]",12575,58.22,-37.807056700000004,144.985559,25,Winter,True,0.9114700000000001,"i like this phone but neds imprubments good camera, brilliant rich color nice phone fast shipping , i use t-mobile network in california, two lte bars signal only. low speaker sound barely hear the other person",True,77.33009783638673,77.43260000000001,0.10250216361328057
ORD287029,ID0634783913,2022-03-05,Thompson,"[('Alcon 10', 1), ('Lucent 330S', 1), ('iStream', 2), ('iAssist Line', 1)]",12705,40.055,-37.8135585,144.9371334,50,Autumn,True,0.87929,a minnesota opinion the phone seems fine. the sound is a bit low. ok,True,79.54471940897838,80.11,0.5652805910216188
ORD405148,ID4716795368,2022-03-11,Thompson,"[('Alcon 10', 2), ('Toshika 750', 2), ('Universe Note', 1)]",29990,81.13600000000001,-37.818906,144.9533111,0,Autumn,True,0.88471,"as described, great! exactly how it was described. brand new with casing, headphones, and charger. unlocked, i simply inserted my sim card and it has been working great. the price for it was fair and saved from getting into a phone contract. thanks!",True,79.56663387372987,81.13600000000001,1.5693661262701397
ORD029240,ID0250933647,2022-12-05,Bakers,"[('Universe Note', 1), ('Thunder line', 1)]",5630,33.856,-37.8259342,145.00029119999996,50,Summer,False,1.8291099999999998,unresponsive seller it was listed unlocked and it wasn't unlocked hinged to pay to have unlocked,False,68.35111921698842,67.712,0.6391192169884192
ORD435031,ID0361227566,2022-08-25,Nickolson,"[('Alcon 10', 2), ('Candle Inferno', 2), ('Thunder line', 2)]",23120,63.903,-37.80126729999999,144.9748159,25,Winter,True,1.98367,love this thing. easy to setup and  looking forward to adding more smart devices to my home.,True,83.62797030483955,84.99099,1.363019695160446
ORD341571,ID4416171556,2022-01-09,Thompson,"[('iStream', 2), ('Candle Inferno', 2)]",1160,72.726,-37.8054976,144.949578,0,Summer,False,0.8286899999999999,my wife uses this for playing on line games. she loves it,True,73.33201267977564,72.726,0.6060126797756453
ORD368384,ID0579418098,2022-02-25,Nickolson,"[('pearTV', 1), ('iAssist Line', 1)]",8535,46.812,-37.8265624,144.9743124,50,Summer,True,0.9807600000000001,waited four months to review . i didn’t want to rate it till i was sure . i’m sure. it’s great.,True,94.85839679402177,93.624,1.2343967940217766
ORD198026,ID1669788996,2022-01-08,Nickolson,"[('Thunder line', 1), ('pearTV', 2), ('Olivia x460', 1)]",16025,98.17399999999999,-37.816399600000004,144.9825983,0,Summer,True,1.17308,"for a ""dumb"" phone performs great havent jumped on the smart phone bandwagon yet. this phone is easy to use, durable and easily customized. great improvement from the freefom ii.",True,96.76844585978387,98.17399999999999,1.4055541402161253
ORD105607,ID5299390820,2022-03-06,Thompson,"[('iStream', 1), ('iAssist Line', 1), ('Toshika 750', 2)]",11015,59.323,-37.8114704,144.9375319,25,Autumn,True,0.84934,"good lesson my son lost his original at&t phone now he treasure this more than ever,it's simple but it gets the job done",True,79.42362379656008,78.89959,0.5240337965600759
ORD419444,ID3065030526,2022-10-14,Bakers,"[('iStream', 1), ('Toshika 750', 1), ('Candle Inferno', 2), ('Olivia x460', 2)]",7780,75.86,-37.8024286,144.99854309999995,25,Spring,True,0.89131,"fantastic value, highly recommended product came exactly as advertised. in great condition, had a tiny little scratch but really impressed with the value for the money. activated it on sprint, no problems, highly recommended!",True,102.14806556976743,100.8938,1.2542655697674263
ORD323867,ID6167344361,2022-11-13,Nickolson,"[('iAssist Line', 2), ('Thunder line', 1)]",6630,73.972,-37.8157898,144.9693159,0,Spring,False,0.31295,great quality the phone came practically brand new. i just decided a google phone was not for me.,True,72.21840084069807,73.972,1.7535991593019276
ORD028306,ID3191033047,2022-07-18,Nickolson,"[('iAssist Line', 2), ('Thunder line', 1)]",6630,65.633,-37.8110592,144.96933049999996,0,Winter,False,0.83909,looks brand new so far so good. not a scratch on it and it works perfectly. very happy with this purchase.,True,64.9681056500206,65.633,0.6648943499793916
ORD092521,ID0305912790,2022-05-31,Bakers,"[('Olivia x460', 1), ('pearTV', 1), ('iAssist Line', 1), ('Toshika 750', 1)]",14080,66.149,-37.799236900000004,145.0042506,0,Autumn,True,1.4365299999999999,don't have spanish language did not have spanish language,False,66.78733225557968,66.149,0.6383322555796838
ORD337691,ID0777778824,2022-09-14,Thompson,"[('Candle Inferno', 2), ('iAssist Line', 1), ('Lucent 330S', 2), ('iStream', 1)]",5695,87.338,-37.8047494,144.949398,0,Spring,True,0.90553,"highly disappointed. when i got the phone it looked brand new, until i started using it and touched on the top right corner of the screen and a pink line appeared from top to bottom of the phone. highly disappointed.",False,87.29720118480861,87.338,0.040798815191379845
ORD486978,ID0581778436,2022-05-27,Thompson,"[('Lucent 330S', 1), ('iStream', 2), ('Alcon 10', 1)]",10480,59.551,-37.806761200000004,144.938075,25,Autumn,True,1.02896,"not much to say here. cheap, fast and very functional. i was able to install google play store and everything works perfectly. best tablet in its category. if you want something better, you better be ready to pay 3-4 times the price.",True,80.1498740103356,79.20283,0.9470440103355884
ORD372059,ID0578077696,2022-11-28,Thompson,"[('Toshika 750', 1), ('iAssist Line', 1)]",6545,53.097,-37.8194114,144.9324236,50,Spring,True,1.4903899999999999,awesome looking and working phone. this is a great step up from my zenfone 2.,True,107.03385101459406,106.194,0.8398510145940605
ORD358794,ID0591431033,2022-01-31,Nickolson,"[('Thunder line', 2), ('Alcon 10', 2), ('Candle Inferno', 2), ('Universe Note', 1)]",26570,86.86399999999999,-37.8178838,144.9678476,0,Summer,True,0.16942000000000002,amazing camera!!! my wife loves it. the camera is amazing. i just don't like the android os compared to ios. but my wife is quite pleased. the quality of design and speed of phone is incredible.,True,86.8004766140331,86.86399999999999,0.06352338596688867
ORD214114,ID3213448201,2022-01-11,Thompson,"[('Candle Inferno', 1), ('Alcon 10', 2)]",18330,50.101000000000006,-37.8034359,144.9627121,25,Summer,False,1.7176,"not fully unlocked sebastian, the phone is still registered to you. i can’t set up my voicemail. very disappointed that this wasn’t fully unlocked as the advertisement said.",False,67.24364432450128,66.63433,0.6093143245012698
ORD472900,ID4326586219,2022-04-07,Nickolson,"[('Lucent 330S', 2), ('Thunder line', 2)]",6820,48.903,-37.8161974,144.9639882,25,Autumn,False,0.55725,"good budget buy great phone this far. the sim mount i got is plastic, not metal. it was suggested that i should get it changed. although phone box says new there was no phone manual in the box just warranty card and all the accessories. this was the only strange thing i have observed.",True,64.24995144518982,65.04099000000001,0.7910385548101857
ORD483522,ID2188399790,2022-07-26,Nickolson,"[('Toshika 750', 1), ('Thunder line', 2)]",8680,77.168,-37.8127749,144.968184,0,Winter,True,0.65893,"i love this thing.  i enjoy watching the daily news, play music with lyrics (most songs), ordering my coffee..etc",True,75.846732127393,77.168,1.3212678726070095
ORD437308,ID5290706370,2022-10-09,Nickolson,"[('Alcon 10', 2), ('Universe Note', 1), ('Lucent 330S', 2)]",23810,61.026,-37.8081963,144.97684990000005,25,Spring,False,1.32361,you pay for the best and you get the best. thank you best buy for providing this product,True,80.46081907810957,81.16458000000002,0.7037609218904493
ORD130467,ID0593045108,2022-02-24,Bakers,"[('Olivia x460', 1), ('Lucent 330S', 2), ('iAssist Line', 2), ('Toshika 750', 1)]",12455,88.15700000000001,-37.8005658,144.9770053,0,Summer,True,1.91619,two stars did not receive g920a for at&t. received g920p for sprint. not fully compatible.,False,89.23204737873935,88.15700000000001,1.0750473787393418
ORD401202,ID0266739858,2022-07-20,Bakers,"[('Candle Inferno', 1), ('iAssist Line', 2)]",4880,26.909000000000002,-37.8234855,144.9896653,50,Winter,False,1.57938,"lcd screens does not last long screen went purple and then black, the replacement cost to replace lcd screen was almost the cost of the phone",False,54.154948460732825,53.818000000000005,0.33694846073282037
ORD099488,ID4162427921,2022-06-05,Nickolson,"[('iStream', 1), ('Lucent 330S', 2), ('Alcon 10', 1)]",11560,54.746,-37.8197057,144.9706935,25,Winter,True,0.15930999999999998,"this watch is not only very useful, it's very cute and comfortable. i love the fitness aspects-it motivates me to be more active. i also enjoy the ""smartwatch"" abilities. i can read my text messages without anyone knowing it! also, the battery last a few days at the very least.",True,72.91207157648049,72.81218000000001,0.09989157648047353
ORD160781,ID0583063758,2022-11-21,Thompson,"[('iStream', 2), ('Lucent 330S', 1), ('Olivia x460', 2), ('Thunder line', 1)]",6160,106.507,-37.804632299999994,144.9353905,0,Spring,True,1.36238,"five stars as i expected, everything was ok.",True,105.98986791585557,106.507,0.5171320841444356
ORD167755,ID3240572174,2022-11-24,Thompson,"[('Olivia x460', 2), ('iAssist Line', 2), ('pearTV', 2), ('Universe Note', 1)]",22970,62.723,-37.8056135,144.9296361,25,Spring,False,1.7228400000000001,five stars so nice,True,83.71673168266679,83.42159000000001,0.295141682666781
