order_id,customer_id,date,nearest_warehouse,shopping_cart,order_price,delivery_charges,customer_lat,customer_long,delivery_discount,season,is_expedited_delivery,distance_to_nearest_warehouse,latest_customer_review,is_happy_customer,pred1,delivery_charges2,residual
ORD304007,ID2868682191,2022-12-24,Nickolson,"[('Toshika 750', 1), ('Universe Note', 1), ('Olivia x460', 1), ('pearTV', 2)]",21615,50.878,-37.8045626,144.969853,50,Summer,True,1.56227,my refurbished ipod touch is like new. my refurbished ipod touch is like new...very happy with it.,True,100.6337328601164,101.756,1.1222671398836042
ORD408043,ID5797758281,2022-05-02,Thompson,"[('Universe Note', 2), ('iAssist Line', 1), ('Alcon 10', 1)]",18075,77.686,-37.8072309,144.9452928,0,Autumn,True,0.62563,excellent customer support even on the weekends edge cellular is an excellent company i've done business with them on several occasions product is always as advertised looks and performs exactly as new,True,78.51910628557175,77.686,0.8331062855717448
ORD114536,ID0170219384,2022-02-18,Nickolson,"[('Lucent 330S', 2), ('Toshika 750', 2)]",11100,49.446999999999996,-37.8086826,144.9784657,50,Summer,True,1.3535700000000002,it is an extremely light piece of telephone with magnificent ... it is an extremely light piece of telephone with magnificent structure with clear pictures and enormous and clear response. it was worth the price.,True,98.56100386664431,98.89399999999999,0.3329961333556781
ORD101066,ID2187983886,2022-10-24,Nickolson,"[('pearTV', 1), ('iAssist Line', 1), ('Universe Note', 2), ('Candle Inferno', 2)]",16295,45.731,-37.8120494,144.970453,25,Spring,False,0.7329399999999999,i feel like i was robbed. i purchased a dual sim phone however i received a single sim phone. this is totally totally unacceptable.,False,60.67678590480665,60.822230000000005,0.14544409519335488
ORD467000,ID3218293561,2022-03-07,Thompson,"[('iStream', 2), ('Olivia x460', 1), ('Alcon 10', 1), ('Lucent 330S', 2)]",12935,82.04299999999999,-37.8050564,144.956005,0,Autumn,True,1.15609,good the phone was better than what i expected for the price.,True,80.66389354979269,82.04299999999999,1.3791064502073027
ORD067355,ID1217532752,2022-06-18,Thompson,"[('Thunder line', 2), ('iAssist Line', 2), ('Universe Note', 2), ('Candle Inferno', 1)]",16140,31.941,-37.8179481,144.9485035,50,Winter,False,0.60059,great deal... have had phone for a few days and have had no problems. phone is clean and has no scratches or other marks. happy with my purchase so far.,True,63.56720788493387,63.882,0.31479211506612614
ORD269410,ID0633912918,2022-01-31,Thompson,"[('Toshika 750', 1), ('Alcon 10', 1), ('iAssist Line', 1)]",15495,95.649,-37.815684999999995,144.95763380000002,0,Summer,True,0.9877299999999999,expensive the battery life should have been better and the phone is extremely expensive,True,94.92762018206442,95.649,0.7213798179355848
ORD225715,ID0364846732,2022-06-16,Bakers,"[('Lucent 330S', 1), ('Olivia x460', 2)]",3680,49.565,-37.8060498,144.9800541,25,Winter,True,1.40529,porq me gusto pero la camara no sirve,False,65.06922881413908,65.92145000000001,0.8522211858609268
ORD354494,ID6167254951,2022-03-01,Nickolson,"[('Toshika 750', 1), ('Thunder line', 1), ('Candle Inferno', 2), ('Universe Note', 2)]",14260,46.979,-37.8168138,144.9701116,25,Autumn,False,0.20431,four stars really good phone,True,62.822923550468,62.48207,0.3408535504679975
ORD257486,ID0277125043,2022-11-29,Thompson,"[('iAssist Line', 1), ('Olivia x460', 1), ('Alcon 10', 2), ('Thunder line', 1)]",23530,73.229,-37.8128014,144.9427053,25,Spring,True,0.38401,it worked great! needed a gsm device for traveling back home overseas. it worked great!,True,98.01079015386213,97.39457,0.6162201538621304
ORD074841,ID4716795508,2022-12-23,Thompson,"[('Universe Note', 1), ('Alcon 10', 2), ('pearTV', 2), ('iStream', 2)]",34270,46.255,-37.8187631,144.95340359999997,50,Summer,True,0.8774299999999999,great prtoduct great product,True,93.83216254919441,92.51,1.3221625491944025
ORD475292,ID3098154918,2022-07-30,Thompson,"[('Alcon 10', 1), ('Toshika 750', 2), ('Candle Inferno', 1), ('Thunder line', 1)]",20200,67.854,-37.8236375,144.9405157,0,Winter,False,1.34972,best money can buy all in one,True,67.96743657574908,67.854,0.11343657574907695
ORD126890,ID0844489850,2022-01-29,Thompson,"[('Lucent 330S', 1), ('pearTV', 1), ('Alcon 10', 2), ('iAssist Line', 1)]",27665,94.78399999999999,-37.820792499999996,144.9486185,0,Summer,True,0.9140299999999999,awesome phone! s7 is best ever. the only reason i know this phone is not brand new is they had to tell me.,True,94.1956598235647,94.78399999999999,0.5883401764352953
ORD403142,ID0575396015,2022-03-24,Nickolson,"[('Olivia x460', 1), ('Candle Inferno', 1)]",1655,40.435,-37.8210743,144.9830055,50,Autumn,True,1.2148700000000001,five stars it's pretty,True,80.90155632434855,80.87,0.03155632434854283
ORD160609,ID5797758265,2022-04-12,Thompson,"[('iAssist Line', 1), ('Toshika 750', 1)]",6545,57.792,-37.8071223,144.944995,25,Autumn,True,0.64427,"very good seller, excellent cell very good seller, excellent cell, is released and works in venezuela...",True,78.59447263667283,76.86336,1.731112636672833
ORD198264,ID0778942366,2022-09-13,Bakers,"[('Lucent 330S', 2), ('Olivia x460', 2), ('Toshika 750', 1)]",9230,82.344,-37.814160799999996,145.014446,25,Spring,True,1.7521900000000001,"replenish i like the qwerty kepad, it makes texting easy no mispelled words anymore. i do not like the ringtone options i've found it impossible to save my music as ringtones oh and its kind of slow",True,109.16895589116416,109.51752,0.3485641088358449
ORD318571,ID0349920136,2022-06-21,Bakers,"[('Thunder line', 1), ('Toshika 750', 2)]",10820,50.563,-37.8181824,145.00399109999995,25,Winter,False,1.19321,excellent great deal and it works just fine nice phone for the price.,True,67.04813045745253,67.24879000000001,0.2006595425474842
ORD370127,ID0610682568,2022-10-20,Bakers,"[('Candle Inferno', 2), ('Universe Note', 2)]",7760,78.347,-37.8117936,145.00841599999995,0,Spring,False,1.1766,pixel i love this phone more than alcon and olivia's!,True,79.26188184394391,78.347,0.9148818439439168
ORD266081,ID0440506810,2022-01-16,Bakers,"[('iStream', 1), ('Thunder line', 1)]",2330,62.05,-37.803373,144.9828814,25,Summer,True,1.31281,bad battery battery is too bad,False,83.23950679377921,82.5265,0.7130067937792148
ORD361888,ID3161949478,2022-08-10,Thompson,"[('Thunder line', 1), ('Lucent 330S', 2)]",4640,57.402,-37.8087451,144.95576430000003,25,Winter,True,0.8809,its unlocked great phone and unlocked,True,77.15053622347813,76.34466,0.8058762234781227
ORD416964,ID6207152060,2022-07-07,Nickolson,"[('iAssist Line', 1), ('Thunder line', 2)]",6585,50.619,-37.8080029,144.97432849999996,25,Winter,False,1.2517,value works as advertised.,True,67.39168815254655,67.32327000000001,0.06841815254654193
ORD137310,ID2277912678,2022-08-10,Thompson,"[('pearTV', 1), ('Universe Note', 2), ('Thunder line', 2), ('iStream', 1)]",17720,79.437,-37.8224018,144.93737219999997,0,Winter,True,1.37837,worth nice and well packaged,True,80.07256813625673,79.437,0.6355681362567367
ORD202479,ID6207022858,2022-08-24,Nickolson,"[('Alcon 10', 1), ('iStream', 2)]",9250,45.916000000000004,-37.809747200000004,144.9710871,25,Winter,True,0.99413,one star touch screen broke in a week! cost me a conversion kit! not happy,False,62.65416330012205,61.06828000000001,1.5858833001220418
ORD046635,ID2190483591,2022-06-18,Nickolson,"[('pearTV', 1), ('Toshika 750', 2), ('Universe Note', 2)]",21850,38.27,-37.8122458,144.9621679,50,Winter,True,0.95973,glad i bought this.,True,77.61356670910406,76.54,1.0735667091040568
ORD299523,ID0247031987,2022-10-22,Nickolson,"[('iAssist Line', 1), ('iStream', 1), ('Toshika 750', 1), ('Olivia x460', 2)]",9145,100.92399999999999,-37.814108000000004,144.972422,0,Spring,True,0.55966,perfect!! needed a basic phone with no camera! perfect!!,True,99.44330035848222,100.92399999999999,1.4806996415177736
ORD130927,ID2392803738,2022-02-17,Nickolson,"[('Alcon 10', 2), ('iAssist Line', 2), ('Thunder line', 2)]",26710,40.896,-37.8099693,144.9785167,50,Summer,True,1.24242,one star pre paid phone,False,82.54042009588511,81.792,0.748420095885109
ORD465350,ID0319157922,2022-10-23,Nickolson,"[('Alcon 10', 2), ('Thunder line', 2)]",22260,106.825,-37.8050698,144.96830780000005,0,Spring,True,1.50955,great buy! phone came with a 98% battery capacity!,True,107.19011002695115,106.825,0.36511002695114314
ORD056402,ID0122736330,2022-10-07,Thompson,"[('Universe Note', 1), ('Thunder line', 1), ('Olivia x460', 2), ('iAssist Line', 1)]",10305,42.626000000000005,-37.8122894,144.94555580000005,25,Spring,False,0.13976,one star having trouble connecting it to my account.,False,55.83911779677056,56.69258000000001,0.8534622032294479
ORD220622,ID0641022265,2022-12-15,Thompson,"[('iStream', 1), ('Olivia x460', 2)]",2600,36.509,-37.807411,144.9395382,50,Summer,False,0.8841700000000001,five stars phone works great! no flaws.,True,73.88301893065169,73.018,0.8650189306516864
ORD325654,ID3132397292,2022-06-29,Thompson,"[('iAssist Line', 1), ('iStream', 2), ('Thunder line', 1)]",4705,80.275,-37.8066415,144.9587983,0,Winter,True,1.23082,excellent product great product,True,79.2058911331601,80.275,1.0691088668399118
ORD098655,ID6167441001,2022-10-01,Thompson,"[('Lucent 330S', 1), ('Alcon 10', 1), ('pearTV', 1), ('Toshika 750', 2)]",25130,79.671,-37.8093687,144.9607656,25,Spring,True,1.25947,"the digico candle inferno is a great reader on a budget. it has most of the basic functions of standard tablets(ipad, universe tablets) at a fraction of the cost. it also has access to a huge digico library of books.",True,105.15058738549718,105.96243000000001,0.8118426145028366
ORD254183,ID0575429675,2022-05-11,Nickolson,"[('Universe Note', 1), ('Thunder line', 1), ('iStream', 2)]",5930,67.819,-37.8188263,144.9843814,0,Autumn,False,1.30437,"four stars it was perfect. my brother loves it, because it was clean & delivered right on time",True,67.27075124318542,67.819,0.5482487568145871
ORD134042,ID2358071077,2022-03-21,Bakers,"[('iStream', 2), ('Thunder line', 2)]",4660,60.235,-37.8084225,144.97979899999999,25,Autumn,True,1.3685399999999999,totes amaze best phone i’ve ever owned. switched from pear.,True,81.52288396242274,80.11255,1.4103339624227402
ORD277225,ID5776644660,2022-06-03,Bakers,"[('Toshika 750', 2), ('iAssist Line', 1)]",10865,33.783,-37.8007475,145.0034602,50,Winter,False,1.25843,my favourite phone so far. i love this phone.. it's amazing. great buy.,True,67.43121872679826,67.566,0.13478127320173883
ORD485481,ID1668523294,2022-07-13,Nickolson,"[('iStream', 2), ('Toshika 750', 1), ('pearTV', 1), ('Lucent 330S', 1)]",12160,38.133,-37.8215275,144.9617357,50,Winter,True,0.7608199999999999,i've enjoyed using my inferno hd8 tablet to play games.,True,76.44521209923656,76.266,0.17921209923655113
ORD466724,ID1496246573,2022-09-20,Nickolson,"[('Olivia x460', 1), ('Toshika 750', 2)]",9865,48.108999999999995,-37.8263746,144.9811628,25,Spring,False,1.33883,not worth my time and money my husband used this phone for about a week. never dropped it or got it wet and the screen went black then would not come back on. a few days later the phone all of a sudden comes to life. very weird.,False,65.6181101739627,63.98497,1.6331401739627083
ORD342252,ID0581762848,2022-11-27,Thompson,"[('Lucent 330S', 2), ('pearTV', 1), ('Thunder line', 1), ('Alcon 10', 2)]",28850,107.56299999999999,-37.8044169,144.9295844,0,Spring,True,1.7914400000000001,great for games and reading. price was great. great battery life. well worth the money.,True,109.48905851303344,107.56299999999999,1.9260585130334533
ORD202441,ID0581704817,2022-08-20,Thompson,"[('Alcon 10', 2), ('iAssist Line', 1), ('Universe Note', 1)]",23575,40.343,-37.8082105,144.9345625,50,Winter,True,1.20686,"blown away best phone i've ever owned. i was worried about the size at first, but got used to it after a few days. perfect for watching istream or listening to music. so many adjustable features. battery life is excellent despite large display.",True,79.06515524028178,80.686,1.6208447597182243
ORD390426,ID0583242777,2022-09-07,Nickolson,"[('Olivia x460', 1), ('Lucent 330S', 1), ('Candle Inferno', 1), ('Thunder line', 2)]",7245,74.342,-37.815142,144.97491580000005,0,Spring,False,0.60853,got an unbelievable deal!! the best part is having a library of books at my fingertips!! easy and simple to set up and great when i'm traveling!!,True,74.62899785909603,74.342,0.2869978590960329
ORD166464,ID5563404254,2022-11-24,Bakers,"[('Alcon 10', 2), ('iStream', 1)]",18050,40.451,-37.817896399999995,145.00870980000005,50,Spring,False,1.47589,i like i like it it's best one i've gonna for here,True,81.70273569615424,80.902,0.8007356961542342
ORD459988,ID0387153073,2022-04-16,Thompson,"[('Candle Inferno', 2), ('Alcon 10', 2), ('iAssist Line', 2)]",23210,66.167,-37.8019774,144.9527304,0,Autumn,False,1.29055,great phone. great price. great phone. great price. much better than $800 from at&t. thanks!,True,67.21487340132828,66.167,1.0478734013282747
ORD283863,ID5002594941,2022-01-21,Thompson,"[('Olivia x460', 1), ('iStream', 1)]",1375,67.14399999999999,-37.8120238,144.9523039,25,Summer,True,0.46602,okay phone okay phone,True,89.74619496316495,89.30152,0.4446749631649567
ORD323405,ID0289607026,2022-02-13,Thompson,"[('Lucent 330S', 2), ('Universe Note', 1), ('Thunder line', 1), ('Alcon 10', 2)]",25990,66.648,-37.813573299999995,144.9502382,25,Summer,True,0.29618,phone great phone for a reasonable price!,True,88.05940870417456,88.64184,0.5824312958254438
ORD401393,ID0248236928,2022-10-03,Bakers,"[('Thunder line', 2), ('Candle Inferno', 2)]",5220,70.173,-37.8260228,145.0010929,0,Spring,False,1.857,"it works but the front button is all scratched the phone has a few hits, as expected.the front button it's all scratched and it should not be in that kind of condition. finally the charger came broken, the plastic on the edge of the cord that connects with the phone has its metal exposed.",False,69.84403566629398,70.173,0.3289643337060255
ORD186171,ID0581765998,2022-09-20,Thompson,"[('Alcon 10', 2), ('Lucent 330S', 1)]",19130,44.626000000000005,-37.8058839,144.9372744,50,Spring,True,1.14594,the phone quality was below expectations the phone screen have a lot of scratches. and home screen menu is not working properly,False,89.25786032681097,89.25200000000001,0.005860326810960714
ORD203009,ID4460254044,2022-05-28,Thompson,"[('Candle Inferno', 2), ('Lucent 330S', 2), ('Thunder line', 1), ('Toshika 750', 1)]",9820,67.39699999999999,-37.8025669,144.94566830000005,0,Autumn,False,1.13173,"it is the best phone once i got the hang of it, it is the best phone year",True,66.572722978481,67.39699999999999,0.824277021518995
ORD482934,ID1479905374,2022-01-22,Thompson,"[('Thunder line', 2), ('iStream', 2), ('Universe Note', 2)]",11560,73.69,-37.820938399999996,144.95603400000005,25,Summer,True,1.21163,"i was skeptical at first but &#34;it&#34; grows on you.  it looks good, so far.  i did, however, turn off the camera.",True,97.15130979221486,98.0077,0.8563902077851395
ORD152972,ID0541122905,2022-07-13,Bakers,"[('Alcon 10', 2), ('iStream', 1), ('Thunder line', 2)]",22410,41.349,-37.802745200000004,145.0094654,50,Winter,True,1.48949,five stars it's awesome,True,80.7252631452984,82.698,1.9727368547015942
ORD469503,ID0387153038,2022-08-21,Thompson,"[('Lucent 330S', 2), ('Candle Inferno', 2), ('iAssist Line', 1)]",5545,34.597,-37.798676,144.94880859999995,50,Winter,False,1.56562,gift gift,True,69.23558679580033,69.194,0.041586795800327536
ORD330631,ID1681675844,2022-09-11,Nickolson,"[('Olivia x460', 2), ('Universe Note', 2), ('Candle Inferno', 2)]",10210,39.668,-37.809818299999996,144.97650280000005,50,Spring,False,1.1525100000000001,phone is good to have i liked the phone overall price was decent and its a good phone,True,79.0654163111839,79.336,0.27058368881610306
ORD133521,ID4315294440,2022-06-09,Thompson,"[('pearTV', 2), ('iStream', 1), ('Candle Inferno', 2), ('Alcon 10', 1)]",22580,32.516,-37.8171713,144.9533137,50,Winter,False,0.74317,awesome phone and headset great combo.. excellent battery and performance...,True,64.40469217569306,65.032,0.6273078243069392
ORD220185,ID5402876215,2022-04-16,Nickolson,"[('iStream', 1), ('Alcon 10', 1), ('Toshika 750', 1), ('Candle Inferno', 1)]",13850,49.146,-37.8210635,144.9782837,25,Autumn,False,0.8155899999999999,five stars excellent for the price for an average smart phone user. no complaints whatsoever.,True,65.2944870215553,65.36418,0.06969297844470645
ORD266136,ID2190483592,2022-09-25,Nickolson,"[('Alcon 10', 2), ('iStream', 2), ('Candle Inferno', 1)]",18630,44.165,-37.812301,144.9623539,50,Spring,True,0.9441700000000001,don’t recommend any phone from digico phone doesn’t work it was a waste of money. it only worked for a few days then started to reboot every minute i reset the phone to factory settings thinking it would fix issue but it didn’t. called lucent said they can’t do anything because phone is not from the us,False,87.6123289633826,88.33,0.7176710366174035
ORD007088,ID5427911108,2022-05-18,Thompson,"[('iStream', 2), ('Olivia x460', 2)]",2750,68.85300000000001,-37.802094,144.9606107,0,Autumn,False,1.6749,really like the phone only one issue it won't auto connect ... really like the phone only one issue it won't auto connect to my wifi .i have to turn it off and back on then will connect. dealing with !!!,True,68.7689000668701,68.85300000000001,0.08409993312990593
ORD322008,ID0591306178,2022-03-30,Nickolson,"[('Lucent 330S', 1), ('Thunder line', 2)]",5590,66.202,-37.8237,144.9563143,0,Autumn,False,1.29525,"reliable phone bought this for my husband as his first smart phone. it has proven to be reliable, and set up is user friendly",True,67.23387671947071,66.202,1.0318767194707164
ORD047735,ID1492145816,2022-03-09,Thompson,"[('Lucent 330S', 2), ('Toshika 750', 1), ('Universe Note', 1), ('iAssist Line', 1)]",12455,76.87,-37.813229,144.9514476,0,Autumn,True,0.39000999999999997,i definitely like this product.  wanted to be able to watch istream on my tv!  easy to install!,True,77.56643355775866,76.87,0.6964335577586525
ORD456226,ID2181268821,2022-08-02,Thompson,"[('Thunder line', 1), ('Candle Inferno', 2), ('Alcon 10', 1), ('Universe Note', 1)]",15440,50.431000000000004,-37.811082899999995,144.9588361,25,Winter,False,1.04988,five stars my favorite phone,True,66.20624082780942,67.07323000000001,0.8669891721905856
ORD150766,ID4315827374,2022-06-01,Bakers,"[('Olivia x460', 2), ('Alcon 10', 1)]",11400,33.806,-37.819763099999996,144.9989418,50,Winter,False,1.13513,"i received in good condition as new but have not used it yet i received in good condition as new but have not used it yet. i will let you know later. thank you,",True,66.70698101428172,67.612,0.9050189857182716
ORD235435,ID2597770349,2022-01-09,Nickolson,"[('Thunder line', 2), ('Universe Note', 1)]",7810,75.089,-37.827676200000006,144.984998,25,Summer,True,1.69315,quick ship and arrival!!! awesome job. got to me fast and easy. (the same as how i like my women) jk lol nice phone works fine so far and maybe i'll tell ya more after i use for a little while and see if there are any bugs or issues vi feel just need to be talked about.,True,101.93358322267329,99.86837,2.065213222673293
ORD066709,ID0477079749,2022-07-13,Bakers,"[('iAssist Line', 1), ('iStream', 1), ('pearTV', 1)]",8685,34.274,-37.8062074,144.9785247,50,Winter,False,1.5287,five stars excellent,True,69.01872664700787,68.548,0.47072664700786504
ORD432887,ID0711333524,2022-12-04,Thompson,"[('pearTV', 2), ('Candle Inferno', 1), ('Toshika 750', 1)]",17370,96.66799999999999,-37.8064407,144.9571255,0,Summer,True,1.12409,el mejor de todos el mejor celular que he comprado hasta este dia lo mejor de lo mejor supera a alcon eleven pro por mucho desde resolución de camara hasta velocidades de ram es superior hasta con los olivia note o el de última generación.,True,96.28189581958168,96.66799999999999,0.3861041804183145
ORD274252,ID0418104790,2022-03-07,Bakers,"[('Universe Note', 1), ('Thunder line', 1)]",5630,59.498999999999995,-37.8184492,144.9904138,25,Autumn,True,1.03197,as advertisered like everything so far.,True,80.16204422046512,79.13367,1.0283742204651247
ORD440308,ID2457712055,2022-08-26,Bakers,"[('Universe Note', 2), ('pearTV', 2)]",19520,34.422,-37.805,144.97871980000005,50,Winter,False,1.55508,five stars seems to be doing great for my husband,True,69.1736771000183,68.844,0.3296771000183014
ORD086772,ID6167191697,2022-10-10,Thompson,"[('Candle Inferno', 1), ('pearTV', 1), ('Universe Note', 1)]",10190,103.259,-37.818865,144.9548997,0,Spring,True,0.97431,"love it i just got my phone yesterday so i'm just getting used to it. so far it is great. i love the camera. how fast it is. but the home ""button and back button "" aren't really buttons they are right under the keyboard so i end up hitting them all the time. only drawback so far",True,102.82497047715978,103.259,0.4340295228402198
ORD239129,ID0589766049,2022-10-04,Thompson,"[('iAssist Line', 2), ('Thunder line', 1), ('iStream', 1)]",6780,52.36,-37.8221771,144.9477447,50,Spring,True,1.05961,"great purchase-best money /value this phone is all you need. the pictures are really good, battery life is very good - it lasts all day playing pokémon go. the screen glass feels great to the touch and response time is awesome.",True,103.52063299041964,104.72,1.1993670095803566
ORD276036,ID1490182711,2022-06-04,Nickolson,"[('iStream', 1), ('iAssist Line', 1)]",2375,32.04,-37.8220691,144.9738881,50,Winter,False,0.54314,mint condition very happy with my phone would buy another one,True,63.22975892642556,64.08,0.8502410735744377
ORD379458,ID0373651914,2022-06-01,Thompson,"[('Lucent 330S', 1), ('Olivia x460', 1), ('pearTV', 1), ('iStream', 2)]",9065,41.191,-37.8114421,144.92733069999997,50,Winter,True,1.74125,good with non-us brick great product that came with a non-us power brick. seller should state this.,True,82.20404730185285,82.382,0.17795269814715198
ORD421031,ID4405283289,2022-11-12,Thompson,"[('Alcon 10', 1), ('Universe Note', 1), ('pearTV', 1)]",18710,68.913,-37.8264748,144.9516952,0,Spring,False,1.5893,durability is zero of it falls screen first it fell once from a table indoors and the screen cracked and blacked out and never came back on.,False,67.66081345293334,68.913,1.2521865470666569
ORD166407,ID2810279743,2022-08-07,Bakers,"[('pearTV', 1), ('iAssist Line', 2), ('Lucent 330S', 1), ('Candle Inferno', 1)]",12420,64.041,-37.8169154,144.9881339,0,Winter,False,0.9914200000000001,"three stars it was a gift, the charger does not wok for the phone.and it is not unlock",True,65.86285934627077,64.041,1.8218593462707702
ORD054620,ID0579486986,2022-05-01,Thompson,"[('iAssist Line', 2), ('Toshika 750', 1), ('Universe Note', 1)]",12220,36.306,-37.814786700000006,144.94948480000005,25,Autumn,False,0.317,"bad battery! had issues charging from day 1, by day 12 it no longer charges at all. so far return/exchange not as easy as they tell you...still going through that process, sigh. also, phone was not as nice as expected but i'm just putting in a case so who cares but just so u know it will have scuffs n scratches.",False,48.268105528937085,48.28698,0.018874471062915177
ORD194916,ID6167230998,2022-05-15,Thompson,"[('Toshika 750', 1), ('Olivia x460', 2), ('iAssist Line', 2), ('Lucent 330S', 2)]",13680,47.998999999999995,-37.8169763,144.9534055,25,Autumn,False,0.73482,this is an item that is easy to use for novices. my child uses it and has no issues,True,64.9679129776479,63.83867,1.1292429776478983
ORD168924,ID0031477169,2022-05-07,Bakers,"[('iStream', 1), ('Olivia x460', 2), ('Alcon 10', 2), ('Lucent 330S', 1)]",21730,40.422,-37.7989598,144.9842738,25,Autumn,False,1.5614700000000001,"not an at&t phone this is not an at&t phone. after many frustrating hrs trying to see of i can get this phone to work with at&t, we were able to conclude that not onlybia it not an at&t phone but it's not compatible either! pretty upsetting!",False,53.2998202797289,53.76126,0.4614397202711018
ORD289308,ID0912832679,2022-11-29,Nickolson,"[('Toshika 750', 1), ('Olivia x460', 2), ('Universe Note', 1)]",10220,102.148,-37.8177602,144.9788454,0,Spring,True,0.82258,husband loves it!,True,101.5875393735617,102.148,0.5604606264382994
ORD175273,ID3924911403,2022-11-01,Nickolson,"[('Thunder line', 1), ('Candle Inferno', 1), ('Toshika 750', 2)]",11250,44.236999999999995,-37.81330420000001,144.96560490000005,25,Spring,False,0.6835899999999999,exactly what you worry about with a refurbish purchase. :( battery is basically dead. how do you not refurbish that of all things?,False,60.27431292673662,58.83521,1.4391029267366235
ORD059591,ID0026680093,2022-05-13,Thompson,"[('Toshika 750', 2), ('Lucent 330S', 1), ('iStream', 2), ('Candle Inferno', 2)]",11030,61.951,-37.812178100000004,144.94445380000005,0,Autumn,True,0.23649,"cannot turn off shutter sound, poor battery life came from a country where it is illegal to turn off shutter sound, so every time i take a picture there is a loud obnoxious shutter sound which can not be avoided. battery life is poor, some glitching",False,61.935259510121625,61.951,0.015740489878375286
ORD361029,ID6273358850,2022-03-30,Thompson,"[('pearTV', 1), ('Alcon 10', 1), ('iAssist Line', 1), ('Lucent 330S', 1)]",18715,34.834,-37.799531,144.9621939,50,Autumn,False,1.97732,"one of my better purchases off of digico absolutly, 100% meant my expectations. one of my better purchases off of digico! thank you!!",True,69.9916625078566,69.668,0.32366250785659645
