order_id,customer_id,date,nearest_warehouse,shopping_cart,order_price,delivery_charges,customer_lat,customer_long,delivery_discount,season,is_expedited_delivery,distance_to_nearest_warehouse,latest_customer_review,is_happy_customer,pred1,delivery_charges2,residual
ORD119514,ID0579506494,2022-08-27,Thompson,"[('Olivia x460', 2), ('Toshika 750', 1), ('Alcon 10', 2)]",24670,44.678000000000004,-37.8135387,144.9481638,0,Winter,False,0.13621,"very bad received the equipment and never lit, i thought it came fully discharged and discarded with other chargers actually burnt wine team, plus it did not bring handsfree or a user's manual, i am very upset about the teasing after me to trust in you",False,45.67807790458933,44.678000000000004,1.0000779045893253
ORD019664,ID0227330544,2022-11-28,Bakers,"[('pearTV', 1), ('Universe Note', 1), ('iStream', 2), ('Lucent 330S', 2)]",12520,75.646,-37.8033282,144.994517,0,Spring,False,0.7449100000000001,well worth it very impressed with the option to use on the phone,True,75.7412423322306,75.646,0.09524233223059753
ORD327270,ID3215191986,2022-11-03,Thompson,"[('Toshika 750', 2), ('Olivia x460', 2), ('Universe Note', 1)]",14540,76.45,-37.8065644,144.9516826,25,Spring,True,0.79187,great phone really great phone. appears to pick up a much faster internet frequency in south africa. clear pictures. works fast. delivery was much sooner than expected.,True,101.33708455782653,101.67850000000001,0.34141544217348496
ORD202981,ID4740822062,2022-08-06,Thompson,"[('Lucent 330S', 2), ('Candle Inferno', 2), ('Alcon 10', 1)]",12270,61.863,-37.8036557,144.94979030000005,0,Winter,True,1.0319399999999999,"it at&t phone, it no unlocked ph, it at&t phone,it no unlocked ph,",False,62.876251117723434,61.863,1.013251117723435
ORD479653,ID3098154908,2022-05-26,Thompson,"[('Candle Inferno', 1), ('Alcon 10', 1), ('Toshika 750', 1), ('Thunder line', 2)]",18060,60.906000000000006,-37.822999700000004,144.93749440000005,25,Autumn,True,1.42487,"a very good phone all around. loved the note 10 plus, prriod.",True,81.75064075198947,81.00498000000002,0.7456607519894476
ORD197826,ID0282825893,2022-07-23,Thompson,"[('Lucent 330S', 2), ('pearTV', 1), ('iStream', 2)]",9070,50.16,-37.8036161,144.9541139,25,Winter,False,1.1833799999999999,"all good the phone was new, shipped fast and was exaclty what i though it would be. i really love the phone and it has been working great for me.",True,66.99039114914729,66.7128,0.277591149147284
ORD378828,ID0589713786,2022-05-25,Nickolson,"[('Toshika 750', 1), ('iStream', 2), ('Olivia x460', 1), ('Alcon 10', 2)]",23745,39.949,-37.8206673,144.956766,50,Autumn,True,1.1476600000000001,"perfect! wouldn't have known this was reconditioned. looks and acts perfect, no trouble of any kind. the phone itself is top notch.",True,80.62980887491167,79.898,0.7318088749116782
ORD035319,ID0358732434,2022-10-13,Nickolson,"[('Toshika 750', 1), ('Lucent 330S', 1), ('Candle Inferno', 1), ('iStream', 2)]",6280,67.336,-37.81869810000001,144.98401930000003,25,Spring,True,1.27233,"good for the price if you want a basic phone with ad's then get this. the camera quality is poor, grainy and tends to over compensate for everything so your pictures come out poor.",False,90.2886315466341,89.55688,0.7317515466340865
ORD392820,ID2442297408,2022-02-19,Thompson,"[('pearTV', 2), ('Universe Note', 1)]",16070,72.736,-37.8178098,144.95166609999995,0,Summer,False,0.70027,"very expeditiously and been a nice phone for me so far the product came as advertised, brand new. it was delivered on time, very expeditiously and been a nice phone for me so far.",True,72.0565941012338,72.736,0.6794058987662055
ORD105041,ID0638051070,2022-06-08,Nickolson,"[('Toshika 750', 1), ('pearTV', 1)]",10630,73.705,-37.8182464,144.96628280000004,0,Winter,True,0.29,still learning to use it in its full glory what i have seen so far i love it! verizon's plans are kind of expensive though. haven't figured out an easy way to carry it around.,True,73.67971656146659,73.705,0.025283438533406866
ORD005628,ID0591430512,2022-02-22,Nickolson,"[('Alcon 10', 1), ('Universe Note', 2)]",15850,44.763000000000005,-37.817782799999996,144.9663077,50,Summer,True,0.29919,nice phone but... its a nice phone but its a brick! it is heavy and i wont be able to carry in my pocket. it is user friendly. i like windows for that reason. we have the fastest internet we can have and the phone still loads very slowly.,True,88.08930287892468,89.52600000000001,1.4366971210753263
ORD473701,ID4716795546,2022-09-07,Thompson,"[('Olivia x460', 2), ('iAssist Line', 1), ('Universe Note', 2)]",11575,77.845,-37.8194003,144.95279019999995,25,Spring,True,0.9021600000000001,not bad for the price the charger was not original. it heated up on charging. the phone was in good condition. everything worked like a charm. the phone was previously locked to t mobile. every time i restart the phone i can see t mobile intro screen load up.,True,102.23655253657716,103.53385,1.2972974634228365
ORD407349,ID0377544273,2022-03-20,Thompson,"[('Olivia x460', 1), ('iAssist Line', 2)]",5675,58.126000000000005,-37.814846,144.94589030000003,25,Autumn,True,0.26314,"works well works real well, my son likes it.",True,77.05346526568817,77.30758000000002,0.25411473431184106
ORD264690,ID1282403407,2022-06-12,Thompson,"[('iAssist Line', 2), ('pearTV', 2), ('Thunder line', 1)]",19250,33.635,-37.813266799999994,144.9586428,50,Winter,False,1.0199799999999999,excellent phone 6 months working great,True,66.03061465097045,67.27,1.239385349029547
ORD389262,ID3161948949,2022-03-14,Thompson,"[('iAssist Line', 2), ('Toshika 750', 1)]",8770,66.921,-37.8087898,144.9573786,0,Autumn,False,1.00447,my 10 year old has enjoyed playing on this. great selection of apps and games.,True,66.05817781533061,66.921,0.8628221846693975
ORD361563,ID1838361813,2022-06-23,Nickolson,"[('pearTV', 1), ('Olivia x460', 2)]",8760,56.629,-37.8145064,144.9660349,25,Winter,True,0.55023,"looks like new ! i bought this in february 2018 . i was so excited because it was so beautiful , no dent or scratches anywhere. everything works perfect . i hope stays like this for few more years :))",True,75.20825167848345,75.31657,0.10831832151654908
ORD125354,ID0472236184,2022-10-01,Nickolson,"[('Olivia x460', 2), ('Universe Note', 2), ('iAssist Line', 1)]",11575,88.087,-37.79896110000001,144.96652219999999,0,Spring,False,2.2017599999999997,thank you thank you,True,87.62255455312878,88.087,0.464445446871224
ORD056830,ID2621587173,2022-04-09,Bakers,"[('pearTV', 2), ('Candle Inferno', 1), ('Olivia x460', 1), ('Universe Note', 1)]",17725,51.956,-37.8040814,145.00898059999997,0,Autumn,False,1.37681,"terrible experience! buy a newer phone first day and the battery has to be replaced already, which will cost me another $100. i wish i would have bought a newer phone. terrible experience! buy a newer phone.",False,52.553192039689996,51.956,0.5971920396899932
ORD345486,ID1888086800,2022-04-29,Thompson,"[('iStream', 2), ('Olivia x460', 1), ('iAssist Line', 2), ('Candle Inferno', 1)]",6405,34.717,-37.7999733,144.96254009999996,50,Autumn,False,1.96216,five stars great phone and great price,True,69.93036669869929,69.434,0.4963666986992905
ORD472966,ID0579407285,2022-11-12,Nickolson,"[('Candle Inferno', 1), ('Toshika 750', 1), ('Universe Note', 2)]",11650,72.089,-37.82200200000001,144.96866980000001,0,Spring,False,0.38709,it was in better shape than i expected. it was new as far as i can tell. the add said it was renewed. i was expecting some scuffs or ligh scratches. the universe s9 i received was in new condition.,True,72.8230481880965,72.089,0.7340481880964944
ORD378416,ID3212035128,2022-03-21,Thompson,"[('Candle Inferno', 2), ('Toshika 750', 1), ('iStream', 2), ('Olivia x460', 2)]",7930,76.943,-37.8087101,144.948722,0,Autumn,True,0.4645,s10 plus... get one the phone is simply awesome. no flaws.,True,77.86761593402042,76.943,0.924615934020423
ORD285089,ID0060096860,2022-04-29,Nickolson,"[('Lucent 330S', 2), ('Universe Note', 2)]",9360,76.744,-37.8184834,144.972258,0,Autumn,True,0.23836999999999997,exceeded my expectations this thing is flipping amazing. especially compared to the alcon 7 i replaced. if your a highly industrial type who needs to take quick notes and you don't wanna spend 1000$ on the latest and greatest note i'd recommend this.,True,76.95331373581834,76.744,0.20931373581834123
ORD002761,ID0034160619,2022-06-22,Nickolson,"[('Lucent 330S', 1), ('Thunder line', 1), ('Toshika 750', 2)]",12050,62.857,-37.8010831,144.9697994,25,Winter,True,1.9495,bought for my daughter she loves it. great investment for her watching movies!!,True,83.42726306528812,83.59981,0.17254693471188887
ORD327259,ID0026034672,2022-08-22,Nickolson,"[('iAssist Line', 1), ('Toshika 750', 1), ('Universe Note', 1), ('Lucent 330S', 2)]",12455,38.836,-37.8111201,144.9700211,50,Winter,True,0.83311,perfect cellphone the perfect cellphone,True,76.8698280297947,77.672,0.8021719702052934
ORD418647,ID0955611524,2022-10-08,Nickolson,"[('Alcon 10', 2), ('iAssist Line', 1), ('Toshika 750', 1)]",24445,81.381,-37.8034065,144.9665448,25,Spring,True,1.7112900000000002,great phone but the screen scratches easily the phone works and runs great but within a week the screen was very scratched up,True,108.83539672595516,108.23673000000001,0.5986667259551552
ORD466004,ID1560149598,2022-03-14,Thompson,"[('Lucent 330S', 1), ('iStream', 1), ('iAssist Line', 1)]",3605,51.148999999999994,-37.8152763,144.9366486,0,Autumn,False,0.9611,you have to purchase to many accessories for it to work.,False,50.87236876628713,51.148999999999994,0.27663123371286247
ORD027754,ID0600744935,2022-08-13,Nickolson,"[('iStream', 1), ('Candle Inferno', 1), ('Thunder line', 1)]",2760,57.751999999999995,-37.8115767,144.9662735,25,Winter,True,0.83273,"thank you. though it came with a noticeable scratch on the upper left hand side of the phone, it still appeared brand new. it never leaves my site.",True,76.86759599142685,76.81016,0.05743599142685696
ORD025528,ID3610014308,2022-10-16,Bakers,"[('Universe Note', 1), ('pearTV', 1)]",9760,81.09,-37.8171376,144.9856804,0,Spring,False,1.1565299999999998,the phone is great but i ordered it unlocked and it came locked the phone is great but i ordered it unlocked and it came locked. thanks to tony at digico he sought out this the problem for me so i am a very happy customer. thanks again tony you were a great help.,True,79.09820134404795,81.09,1.9917986559520529
ORD018125,ID6167191719,2022-07-17,Thompson,"[('Candle Inferno', 1), ('Toshika 750', 2), ('iAssist Line', 2)]",13520,47.442,-37.8184396,144.95674540000005,25,Winter,True,1.0659,be ready to buy a new battery the battery sucks. it dies at 70% and i've only had it a month. update: after 2 months the phone no longer charges.,False,63.07572486238736,63.097860000000004,0.02213513761264352
ORD370335,ID0312719417,2022-07-04,Thompson,"[('Lucent 330S', 1), ('iStream', 1)]",1380,71.96300000000001,-37.8003085,144.96297880000003,0,Winter,False,1.9627700000000001,nearly perfect phone came in perfect condition. my only issue was the phone came with a roku power supply instead of an actual phone charger. no a major issue for me since i already have multiple usb c turbo chargers,True,71.56836057946573,71.96300000000001,0.3946394205342756
ORD426925,ID0575397935,2022-03-04,Nickolson,"[('iStream', 2), ('Thunder line', 2), ('Toshika 750', 1), ('Universe Note', 2)]",15880,50.408,-37.8212343,144.98373769999995,25,Autumn,False,1.28162,best phone 2019 nowadays like the expected,True,67.17876709685765,67.04264,0.13612709685764912
ORD365174,ID0660544730,2022-04-23,Bakers,"[('Alcon 10', 1), ('Toshika 750', 1), ('Olivia x460', 1), ('iStream', 2)]",14795,65.95100000000001,-37.816937,144.9898112,0,Autumn,False,0.9078700000000001,"really love it the only problem i have is that i can peal the glass back off easily. it would not fall off, however, so i'm impressed. i bought this used, but i can barely tell that it was.",True,65.66759897861579,65.95100000000001,0.28340102138422196
ORD423765,ID0635529205,2022-06-02,Thompson,"[('Candle Inferno', 2), ('pearTV', 1)]",7170,57.507,-37.814045,144.93963430000005,25,Winter,True,0.6714100000000001,excelente teléfono super feliz,True,75.92003696642143,76.48431000000001,0.5642730335785728
ORD160370,ID0664379624,2022-01-31,Nickolson,"[('Thunder line', 1), ('pearTV', 1), ('Lucent 330S', 2), ('iAssist Line', 2)]",15400,27.162,-37.8209865,144.9660368,50,Summer,False,0.40788,don't buy this phone this phone is obsolete. verizon won't activate this phone.,False,54.236003608975395,54.324,0.08799639102460333
ORD187799,ID1095506253,2022-08-09,Bakers,"[('Universe Note', 1), ('iStream', 2), ('Alcon 10', 2), ('Candle Inferno', 1)]",22080,59.492,-37.800684000000004,144.98579709999996,25,Winter,True,1.3278299999999998,"fantastic screen display, its fast , excellent camera the fingerprint sensor could be upgraded to one that works!",True,79.77570703333228,79.12436,0.6513470333322857
ORD398415,ID0128982276,2022-03-01,Nickolson,"[('Candle Inferno', 2), ('Alcon 10', 1)]",9810,48.298,-37.81780379999999,144.9624239,25,Autumn,True,0.63289,"upgrade to olivia 7 instead! i was very disappointed with this phone, mostly because i kept having to ""resend"" text messages, my phone calls kept dropping/the reception was awful, had problems connecting with t-mobile network, and the quality of the pictures was disappointing. bought a olivia 7 instead and so much happier with that phone.",False,63.538007448773314,64.23634000000001,0.6983325512266987
ORD027630,ID0844490410,2022-06-03,Thompson,"[('Olivia x460', 2), ('Alcon 10', 2), ('iStream', 2), ('Candle Inferno', 2)]",21510,39.741,-37.8222831,144.9498288,25,Winter,False,1.09693,... metro pcs this phone is a lie and a waste of time not compatible with metro pcs this phone is a lie and a waste of time,False,51.3211408013362,52.85553,1.5343891986638027
ORD140149,ID0289602878,2022-01-08,Thompson,"[('iAssist Line', 1), ('Universe Note', 2)]",9125,52.831,-37.811453,144.9489719,0,Summer,False,0.21554,broke in less than 2 weeks purchased phone less than 2 weeks ago and can no longer connect to internet.,False,52.325755910822934,52.831,0.5052440891770686
ORD216573,ID3144992718,2022-02-15,Bakers,"[('Olivia x460', 2), ('Candle Inferno', 2)]",3310,93.945,-37.81370870000001,144.9882469,0,Summer,True,0.74038,"great refurbished phone received this a day early and it looks like new. so far, so good. set up was easy and was fully unlocked. was able to get a sim card from our phone company and everything worked just fine.",True,92.47103409420951,93.945,1.4739659057904788
ORD372156,ID0777830142,2022-11-06,Thompson,"[('Olivia x460', 1), ('Candle Inferno', 1), ('Alcon 10', 1), ('iStream', 2)]",10905,82.059,-37.803024799999996,144.95780019999995,0,Spring,False,1.42979,worth the money fingerprint reader is by far the best i've ever had and it is super accurate. fully charges within an hour or an hour and a half depending on percentage. great phone overall and great storage.,True,81.32676803072306,82.059,0.7322319692769383
ORD466981,ID6167231014,2022-10-13,Thompson,"[('Alcon 10', 1), ('Thunder line', 2), ('iAssist Line', 1)]",15535,73.586,-37.8131494,144.9512706,25,Spring,True,0.37329,does its job perfectly amazing phone for a reasonable price,True,97.92336339955796,97.86938,0.05398339955794995
ORD499864,ID1492150984,2022-07-25,Thompson,"[('pearTV', 1), ('iStream', 1)]",6460,38.013000000000005,-37.815176,144.95237680000002,50,Winter,True,0.54361,"looks new the phone looked new, no scratches or dings at all, you'd never know it was a refurb. i haven't been able to get it to fast charge yet, right now i don't know whether it's the phone or the new charger that's the problem, but so far everything else about it is working fine. good deal.",True,75.16936722060137,76.02600000000001,0.8566327793986375
ORD487175,ID0591351805,2022-03-23,Nickolson,"[('Universe Note', 1), ('Lucent 330S', 1), ('iAssist Line', 2)]",9130,26.019000000000002,-37.820953499999995,144.95703740000005,50,Autumn,False,1.13126,i hate edge screen. it is almost perfect phone except that stupid edge screen which makes almost impossible to put screen protector and cause unwanted touch. olivia. please remove that feature.,False,51.56036974822702,52.038000000000004,0.477630251772986
ORD112185,ID5727168122,2022-11-04,Nickolson,"[('Lucent 330S', 2), ('Universe Note', 2)]",9360,48.955,-37.825335700000004,144.9816501,25,Spring,False,1.30188,not what it says it said it was unlocked and it wasn't! i wasted 144 dollars on a phone i can't even use! best believe i'm getting my money back!,False,65.31676515796093,65.11015,0.20661515796092544
ORD228589,ID0145220183,2022-10-27,Nickolson,"[('iStream', 2), ('Toshika 750', 1), ('Alcon 10', 1), ('Lucent 330S', 2)]",16030,100.616,-37.81731170000001,144.95843019999995,0,Spring,True,0.9883,outstanding service an amazing product i love this product and service that they gave me was amazing they're really nice the phone was really nice and stereo was beautiful the screen was amazing the battery life was phenomenal completely worth my money,True,102.93906565371906,100.616,2.3230656537190555
ORD148717,ID0036822139,2022-12-07,Nickolson,"[('Toshika 750', 2), ('Olivia x460', 2)]",11090,77.328,-37.8271503,144.9614665,0,Summer,False,1.18841,"i bought this tablet to replace my old candle inferno. so far, it has exceeded my expectations. all my apps have transferred flawlessly. the battery lasts me 10-12 hours, with moderate internet use. glad i made this purchase.",True,76.90461485290346,77.328,0.42338514709653907
ORD431919,ID0641029599,2022-04-05,Thompson,"[('iStream', 1), ('Lucent 330S', 1), ('pearTV', 1), ('Toshika 750', 2)]",16330,48.738,-37.810275,144.94273940000005,0,Autumn,False,0.46502,two stars batter sucks,False,48.866588752648546,48.738,0.12858875264854674
ORD053691,ID0777905273,2022-06-11,Thompson,"[('Olivia x460', 2), ('iAssist Line', 1)]",4675,40.389,-37.8008218,144.9568101,50,Winter,True,1.57304,"five stars good phone, better then the alcon 5c i had !",True,81.21601789696714,80.778,0.4380178969671391
ORD124198,ID0441588030,2022-10-09,Thompson,"[('Universe Note', 2), ('Olivia x460', 1), ('Toshika 750', 2)]",16765,37.897,-37.811849,144.9382358,50,Spring,False,0.7822100000000001,love my phone i can't keep my hands off of it,True,76.04544176651656,75.794,0.2514417665165638
ORD275741,ID1449431476,2022-09-24,Nickolson,"[('Thunder line', 2), ('Olivia x460', 2)]",6810,99.985,-37.8131754,144.973829,0,Spring,True,0.7109800000000001,amazing worked perfect like if it was brand new out of the box.,True,100.6773877149474,99.985,0.6923877149474009
ORD244324,ID2151742996,2022-08-04,Thompson,"[('Olivia x460', 2), ('iAssist Line', 2), ('iStream', 1)]",7050,49.887,-37.8165987,144.9331971,25,Winter,False,1.29579,excellent tablet for this price is wonderfull and great performance,True,67.65066334106929,66.34971,1.3009533410692882
ORD041545,ID3115762682,2022-01-23,Thompson,"[('Alcon 10', 2), ('Toshika 750', 2), ('Lucent 330S', 1), ('iStream', 1)]",27920,47.38,-37.805391,144.9576126,25,Summer,False,1.23166,when i tried to activate the phone with verizon they informed me that the phone had been reported stolen when i tried to activate the phone with verizon they informed me that the phone had been reported stolen. i have asked for a refund . buyer beware,False,62.417473135771885,63.01540000000001,0.5979268642281212
ORD417160,ID2347007250,2022-01-27,Thompson,"[('Universe Note', 2), ('pearTV', 2), ('Olivia x460', 1), ('Thunder line', 2)]",25105,96.766,-37.821442499999996,144.9450779,0,Summer,True,0.99175,the phone was in good condition was nice and everything,True,94.96754529252804,96.766,1.7984547074719615
ORD409264,ID3157171387,2022-01-02,Nickolson,"[('Universe Note', 2), ('Alcon 10', 1), ('Thunder line', 1)]",18030,72.493,-37.8215268,144.9562204,25,Summer,True,1.21679,nice i like 7plus it’s good,True,97.20255694892936,96.41569,0.786866948929358
ORD427779,ID0580186550,2022-06-23,Thompson,"[('Alcon 10', 1), ('Lucent 330S', 2)]",11410,70.14,-37.7998828,144.92727050000005,0,Winter,True,2.24927,had the digico inferno tv box fox 1 week and it broke,False,70.02658602914077,70.14,0.11341397085922722
ORD006497,ID0571467856,2022-06-17,Bakers,"[('pearTV', 2), ('Candle Inferno', 1), ('Lucent 330S', 1)]",14280,28.409000000000002,-37.8205351,145.0144159,50,Winter,False,2.05484,two stars verizon service sucks and roams way too much!!!,False,56.94769836173131,56.818000000000005,0.12969836173130744
ORD020280,ID0207093451,2022-09-24,Bakers,"[('iAssist Line', 2), ('iStream', 2)]",4750,53.422,-37.8078535,145.0086001,50,Spring,True,1.19963,really good and an awesome phone this looked brand new. i loved it only issue is the pen its not exactly good but overall i liked it. i hope it lasts for some time,True,104.66256341370973,106.844,2.1814365862902605
ORD494124,ID0708717121,2022-04-27,Thompson,"[('Lucent 330S', 1), ('pearTV', 2), ('Candle Inferno', 2), ('Alcon 10', 2)]",32610,79.812,-37.8062298,144.9580375,0,Autumn,True,1.2020899999999999,"and he loved it. it was a present, and he loved it.",True,80.84988347203785,79.812,1.0378834720378478
ORD431166,ID6167289319,2022-10-06,Nickolson,"[('Thunder line', 2), ('iAssist Line', 1)]",6585,78.764,-37.8082347,144.9686435,25,Spring,True,1.15604,"love it! really nothing more to say. i love this phone, exactly what i wanted.",True,104.30706600511655,104.75612,0.44905399488344244
ORD324807,ID1479897558,2022-08-22,Nickolson,"[('Universe Note', 2), ('Candle Inferno', 1), ('Lucent 330S', 2)]",9790,66.825,-37.8202287,144.9575767,0,Winter,False,1.06855,fast! this is fast phone and elegant,True,66.31590439709315,66.825,0.5090956029068536
ORD224865,ID2324975791,2022-10-06,Nickolson,"[('Toshika 750', 1), ('Olivia x460', 2), ('Universe Note', 1)]",10220,38.223,-37.8103051,144.9726914,50,Spring,False,0.96325,great phone this is the best phone i have owned by far i like everything if there was a falt everything else is so good that it makes up for it.,True,77.52191001271308,76.446,1.0759100127130807
ORD088887,ID6167344581,2022-12-01,Nickolson,"[('Universe Note', 1), ('Olivia x460', 1)]",4675,67.539,-37.8158964,144.972506,25,Summer,True,0.3972,not compatible with istream overall the phone functions great but i would not have bought it knowing istream is not compatible.,True,89.0627009079146,89.82687000000001,0.7641690920854103
ORD383658,ID0583063808,2022-04-18,Thompson,"[('Universe Note', 2), ('Thunder line', 2), ('iAssist Line', 2)]",15710,61.766000000000005,-37.807913299999996,144.9316332,25,Autumn,True,1.4572399999999999,just ok i bought this phone for my dad and he hasn't had any complains with it except for the fingerprint reader. the fingerprint reader never works on the first try. may be it takes getting used to.,True,81.88152105162155,82.14878000000002,0.2672589483784691
ORD100607,ID1964021914,2022-03-02,Nickolson,"[('iAssist Line', 1), ('Alcon 10', 1), ('Universe Note', 1)]",14625,46.888999999999996,-37.818243100000004,144.96680609999999,25,Autumn,False,0.24453000000000003,great phone good phone i just pray that it lasts because it is used,True,62.98554343465713,62.36237,0.6231734346571329
ORD266111,ID2959992602,2022-10-01,Nickolson,"[('Universe Note', 1), ('Olivia x460', 2), ('Alcon 10', 1)]",14850,97.008,-37.8180834,144.9661608,0,Spring,True,0.30351,"great phone. feels great in my hand great phone. feels great in my hand, has an amazing camera and display. only drawback i could find was the speakers. they aren't great when you are doing speakerphone. this phone gets and a in my book.",True,97.35427394849967,97.008,0.34627394849967175
ORD008049,ID0847529893,2022-04-11,Nickolson,"[('Candle Inferno', 1), ('Toshika 750', 1), ('Alcon 10', 1), ('Lucent 330S', 2)]",16160,31.730999999999998,-37.82407620000001,144.96852909999996,50,Autumn,False,0.61673,sexyk's note 3 awesome!!!! great phone... was actually like new... no was delivered on time... greatttt purchase 😘😘😘😘,True,64.49044450117115,63.461999999999996,1.0284445011711583
ORD414923,ID1560149580,2022-03-09,Thompson,"[('pearTV', 2), ('Candle Inferno', 1)]",13050,50.208999999999996,-37.816229299999996,144.93732340000003,25,Autumn,False,0.9440299999999999,five stars i am in love with this phone!,True,65.8138032305372,66.77797,0.9641667694627927
ORD205033,ID0364860960,2022-03-30,Bakers,"[('iStream', 2), ('pearTV', 2), ('iAssist Line', 1), ('Candle Inferno', 2)]",16005,51.383,-37.8017911,144.9800967,25,Autumn,False,1.61438,four stars everything ok!!!,True,68.52420202134235,68.33939000000001,0.18481202134233854
ORD491926,ID2935371916,2022-05-10,Bakers,"[('Toshika 750', 1), ('Thunder line', 2)]",8680,62.042,-37.8248484,144.9914158,25,Autumn,True,1.68703,"cool phone very fast good camera good hd video best phone i have ever had, camera works good, does not bomb out and require rebooting, display is really clear, battery last at least one full day",True,82.81062157841966,82.51586,0.2947615784196529
ORD284505,ID6221450543,2022-12-18,Bakers,"[('iAssist Line', 2), ('Alcon 10', 1), ('pearTV', 1)]",19710,60.912,-37.8088031,144.98307490000005,25,Summer,True,1.07739,"is not good at all! i like design, but it's really over heat, i hate it!",False,80.90140492677779,81.01296,0.11155507322222036
ORD475781,ID0589420294,2022-08-01,Nickolson,"[('Candle Inferno', 1), ('Olivia x460', 1)]",1655,33.083,-37.8096803,144.9726434,50,Winter,False,1.02895,the phone meet my expectations. late but it’s fine and work fine.,True,66.08330250402214,66.166,0.08269749597785392
ORD485103,ID6167359491,2022-07-21,Nickolson,"[('iStream', 2), ('iAssist Line', 1)]",2525,38.172,-37.8124701,144.9733891,50,Winter,True,0.76078,this inexpensive tablet does everything i want it to do. i can read my books and magazines and keeps tabs on my kids and grandkids on facebook. very easy to use and crystal clear pictures and video.,True,76.4449771478294,76.344,0.10097714782941125
